{"command":"message.send","data":{"attempt":{"attempt_id":"00000000000000000000000001","completed_event_id":"00000000000000000000000002","config_hash":"sha256:0000000000000000000000000000000000000000000000000000000000000001","created_event_id":"00000000000000000000000003","effect_receipt":{"clock_outcomes":[],"compatibility_warnings":[],"effective_generation_settings":{"provenance":{"continue_prefill":"profile","max_context":"profile","max_tokens":"profile","squash_system_messages":"profile","use_sysprompt":"profile"},"values":{"continue_prefill":false,"max_context":8192,"max_tokens":512,"squash_system_messages":false,"use_sysprompt":true}},"lore":{"activated":[],"budget_tokens":2048,"decisions":[],"overflowed":false,"used_tokens":0},"macro_evaluations":[],"macro_warnings":[],"plugins":[],"preset_transformations":[],"provider_request":{"max_tokens":512,"messages":[{"content":"Write Alice's next reply in a fictional chat between Alice and User.","role":"system"},{"content":"A librarian.\n\nCurious\n\nAn old library","role":"system"},{"content":"Welcome.","role":"assistant"},{"content":"Hello","role":"user"}],"model":"fixture-model","stream":true},"provider_request_hash":"sha256:0000000000000000000000000000000000000000000000000000000000000002","rng_seed":0,"state_mutations":[]},"error_message":null,"prompt_plan":{"continuation_prefix":null,"generation_type":"normal","lore":{"activated":[],"budget_tokens":2048,"decisions":[],"overflowed":false,"used_tokens":0},"macro_evaluations":[],"macro_warnings":[],"messages":[{"content":"Write Alice's next reply in a fictional chat between Alice and User.","role":"system"},{"content":"A librarian.\n\nCurious\n\nAn old library","role":"system"},{"content":"Welcome.","role":"assistant"},{"content":"Hello","role":"user"}],"parent_candidate_id":null,"plugin_receipts":[],"pruning":{"context_limit":8192,"kept_tokens":26,"prompt_limit":7680,"pruned_tokens":0,"response_reserve":512},"rng_seed":0,"segments":[{"content":"Write Alice's next reply in a fictional chat between Alice and User.","in_chat_depth":null,"in_chat_order":0,"pruned":false,"raw_content":"Write Alice's next reply in a fictional chat between Alice and User.","role":"system","slot":"main","source":"main-prompt","source_field":null,"source_revision":null,"token_count":14,"truncation_priority":4294967295},{"content":"A librarian.\n\nCurious\n\nAn old library","in_chat_depth":null,"in_chat_order":0,"pruned":false,"raw_content":"A librarian.\n\nCurious\n\nAn old library","role":"system","slot":"charDescription","source":"character-definitions","source_field":null,"source_revision":"sha256:0000000000000000000000000000000000000000000000000000000000000003","token_count":9,"truncation_priority":800},{"content":"Welcome.","in_chat_depth":null,"in_chat_order":0,"pruned":false,"raw_content":"Welcome.","role":"assistant","slot":"chatHistory","source":"greeting","source_field":null,"source_revision":"sha256:0000000000000000000000000000000000000000000000000000000000000003","token_count":2,"truncation_priority":75},{"content":"Hello","in_chat_depth":null,"in_chat_order":0,"pruned":false,"raw_content":"Hello","role":"user","slot":"userInput","source":"current-user-action","source_field":null,"source_revision":null,"token_count":1,"truncation_priority":4294967295}],"state_mutations":[],"tokenizer":"tiktoken:o200k_base","total_tokens":26},"provider_receipt":{"chunks":[{"choices":[{"delta":{"role":"assistant"},"finish_reason":null,"index":0}],"created":0,"id":"chatcmpl-stcli-fixture","model":"fixture-model","object":"chat.completion.chunk"},{"choices":[{"delta":{"content":"fixture-response:sha256:2c95a1b3f29beb8826fc"},"finish_reason":null,"index":0}],"created":0,"id":"chatcmpl-stcli-fixture","model":"fixture-model","object":"chat.completion.chunk"},{"choices":[{"delta":{"content":"2b1297ad6d634d2c505229010359caec02573c995d1f"},"finish_reason":null,"index":0}],"created":0,"id":"chatcmpl-stcli-fixture","model":"fixture-model","object":"chat.completion.chunk"},{"choices":[{"delta":{},"finish_reason":"stop","index":0}],"created":0,"id":"chatcmpl-stcli-fixture","model":"fixture-model","object":"chat.completion.chunk","usage":{"completion_tokens":3,"prompt_tokens":7,"total_tokens":10}}],"status":200},"provider_request_hash":"sha256:0000000000000000000000000000000000000000000000000000000000000002","retry_of_attempt_id":null,"status":"completed","turn_id":"00000000000000000000000004"},"candidate":{"attempt_id":"00000000000000000000000001","candidate_id":"00000000000000000000000005","content":"fixture-response:sha256:2c95a1b3f29beb8826fc2b1297ad6d634d2c505229010359caec02573c995d1f","created_event_id":"00000000000000000000000002","hidden":false,"origin":"generated","parent_candidate_id":null,"turn_id":"00000000000000000000000004"},"provider_events":[{"event_type":"started"},{"event_type":"text-delta","text":"fixture-response:sha256:2c95a1b3f29beb8826fc"},{"event_type":"text-delta","text":"2b1297ad6d634d2c505229010359caec02573c995d1f"},{"event_type":"usage","usage":{"completion_tokens":3,"prompt_tokens":7,"total_tokens":10}},{"event_type":"completed"}],"turn":{"branch_id":"00000000000000000000000006","created_event_id":"00000000000000000000000007","hidden":false,"selected_candidate_id":"00000000000000000000000005","session_id":"00000000000000000000000008","turn_id":"00000000000000000000000004","user_content":"Hello"}},"error":null,"ok":true,"schema":"stcli.cli/v1","warnings":[]}
